{
  "id": "worksheet-1",
  "title": "Worksheet 1: The Python Calculator",
  "description": "Learn to use Python for basic arithmetic with the print() function.",
  "problems": [
    {
      "type": "concept",
      "icon": "🐍",
      "title": "Welcome to Python",
      "content": "<p><strong>Python</strong> is a programming language, a way of giving instructions to a computer. In this worksheet, you'll use Python as a <strong>calculator</strong>.</p><p>The instruction <code>print(...)</code> means <em>'work out what's inside the brackets and show me the answer'</em>. Python does the calculation, then the answer appears below your code.</p><p>For example:</p><p><code>print(5 + 3)</code> &nbsp;→ shows <strong>8</strong><br><code>print(10 + 7)</code> &nbsp;→ shows <strong>17</strong></p>",
      "footer": "Type code into the box, press Run, and the answer appears below."
    },
    {
      "title": "Adding two numbers",
      "content": "The <code>print()</code> function can be used as a simple calculator. Run this program and observe the output.",
      "task": "Run the code to see the result of the calculation.",
      "starterCode": "print(5 + 3)",
      "hint": "Check the output to see the answer.",
      "validation": {
        "rules": [
          {
            "type": "code_contains_regex",
            "pattern": "print\\s*\\(\\s*5\\s*\\+\\s*3\\s*\\)",
            "description": "Code must contain a print statement with 5 + 3"
          },
          {
            "type": "solution_code",
            "solutionCode": "print(5 + 3)"
          }
        ]
      }
    },
    {
      "title": "Another addition",
      "content": "Here is another problem to practice addition. The <code>+</code> symbol adds numbers together.",
      "task": "Run the program and find out the answer.",
      "starterCode": "print(4 + 8)",
      "hint": "What does four plus eight equal?",
      "validation": {
        "rules": [
          {
            "type": "code_contains_regex",
            "pattern": "print\\s*\\(\\s*4\\s*\\+\\s*8\\s*\\)",
            "description": "Code must contain a print statement with 4 + 8"
          },
          {
            "type": "solution_code",
            "solutionCode": "print(4 + 8)"
          }
        ]
      }
    },
    {
      "title": "Practice addition again",
      "content": "This is another one to practice addition.",
      "task": "Run the program and find out the answer.",
      "starterCode": "print(15 + 20)",
      "hint": "What does fifteen plus twenty equal?",
      "validation": {
        "rules": [
          {
            "type": "code_contains_regex",
            "pattern": "print\\s*\\(\\s*15\\s*\\+\\s*20\\s*\\)",
            "description": "Code must contain a print statement with 15 + 20"
          },
          {
            "type": "solution_code",
            "solutionCode": "print(15 + 20)"
          }
        ]
      }
    },
    {
      "title": "Edit to add",
      "content": "Practice your addition skills by editing this code.",
      "task": "Edit the program to find and print the answer to $50 + 25$.",
      "starterCode": "print(10 + 10)",
      "hint": "Change the numbers inside the brackets to 50 and 25.",
      "validation": {
        "rules": [
          {
            "type": "code_contains",
            "pattern": "print",
            "description": "Code must contain a print statement"
          },
          {
            "type": "solution_code",
            "solutionCode": "print(50 + 25)"
          },
          {
            "type": "code_contains",
            "pattern": "50",
            "description": "Code must contain the number 50"
          },
          {
            "type": "code_contains",
            "pattern": "25",
            "description": "Code must contain the number 25"
          },
          {
            "type": "code_contains",
            "pattern": "+",
            "description": "Code must contain the addition operator"
          }
        ]
      }
    },
    {
      "title": "Fix the brackets",
      "content": "This program has a mistake: the brackets are missing from <code>print</code>. Run it to see the error, then fix it.",
      "task": "Add the missing brackets to make the program work.",
      "starterCode": "print 30 + 20",
      "hint": "The <code>print</code> function needs brackets around what you want to print: <code>print(30 + 20)</code>.",
      "validation": {
        "rules": [
          {
            "type": "code_contains_regex",
            "pattern": "print\\s*\\(",
            "description": "Code must use print with brackets"
          },
          {
            "type": "solution_code",
            "solutionCode": "print(30 + 20)"
          }
        ]
      }
    },
    {
      "title": "Add the print",
      "content": "This program calculates an answer but doesn't print it, so nothing appears when you run it. Try running it to see what happens, then fix it.",
      "task": "Wrap the expression in a <code>print()</code> call so the answer is displayed.",
      "starterCode": "40 + 15",
      "hint": "Put <code>print(</code> before the expression and <code>)</code> at the end.",
      "validation": {
        "rules": [
          {
            "type": "solution_code",
            "solutionCode": "print(40 + 15)"
          },
          {
            "type": "code_contains_regex",
            "pattern": "print\\s*\\(",
            "description": "Code must use print with brackets"
          }
        ]
      }
    },
    {
      "title": "Write to add",
      "content": "Write a complete program to solve this addition problem.",
      "task": "Write a program to find and print the answer to $7 + 13$.",
      "starterCode": "",
      "hint": "Use the <code>print()</code> function with the numbers and the <code>+</code> operator.",
      "validation": {
        "rules": [
          {
            "type": "code_contains",
            "pattern": "print",
            "description": "Code must contain a print statement"
          },
          {
            "type": "solution_code",
            "solutionCode": "print(7 + 13)"
          },
          {
            "type": "code_contains",
            "pattern": "7",
            "description": "Code must contain the number 7"
          },
          {
            "type": "code_contains",
            "pattern": "13",
            "description": "Code must contain the number 13"
          },
          {
            "type": "code_contains",
            "pattern": "+",
            "description": "Code must contain the addition operator"
          }
        ]
      }
    },
    {
      "title": "Adding Apples",
      "content": "Sarah has six apples and buys nine more apples at the store. How many apples does she have in total?",
      "task": "Write a program that adds six and nine and prints the answer.",
      "starterCode": "",
      "hint": "Use the addition operator (+) to add 6 and 9.",
      "validation": {
        "rules": [
          {
            "type": "code_contains",
            "pattern": "print",
            "description": "Code must contain a print statement"
          },
          {
            "type": "solution_code",
            "solutionCode": "print(6 + 9)"
          },
          {
            "type": "code_contains",
            "pattern": "6"
          },
          {
            "type": "code_contains",
            "pattern": "9"
          },
          {
            "type": "code_contains",
            "pattern": "+"
          }
        ]
      }
    },
    {
      "title": "Subtracting two numbers",
      "content": "The <code>-</code> symbol is used for subtraction. What is the answer to this problem?",
      "task": "Run the code and find out the answer.",
      "starterCode": "print(10 - 4)",
      "hint": "What does ten minus four equal?",
      "validation": {
        "rules": [
          {
            "type": "code_contains_regex",
            "pattern": "print\\s*\\(\\s*10\\s*\\-\\s*4\\s*\\)"
          },
          {
            "type": "solution_code",
            "solutionCode": "print(10 - 4)"
          }
        ]
      }
    },
    {
      "title": "Edit to subtract",
      "content": "Now it's your turn to make a small change. Edit the code below to solve the new problem.",
      "task": "Edit the program to find and print the answer to $12 - 7$.",
      "starterCode": "print(20 - 5)",
      "hint": "Change the numbers inside the brackets to 12 and 7.",
      "validation": {
        "rules": [
          {
            "type": "code_contains",
            "pattern": "print"
          },
          {
            "type": "solution_code",
            "solutionCode": "print(12 - 7)"
          },
          {
            "type": "code_contains",
            "pattern": "12"
          },
          {
            "type": "code_contains",
            "pattern": "7"
          },
          {
            "type": "code_contains",
            "pattern": "-"
          }
        ]
      }
    },
    {
      "title": "Write to subtract",
      "content": "Write a complete program to solve this subtraction problem.",
      "task": "Write a program to find and print the answer to $30 - 15$.",
      "starterCode": "",
      "hint": "Remember to use the <code>-</code> operator for subtraction.",
      "validation": {
        "rules": [
          {
            "type": "code_contains",
            "pattern": "print"
          },
          {
            "type": "solution_code",
            "solutionCode": "print(30 - 15)"
          },
          {
            "type": "code_contains",
            "pattern": "30"
          },
          {
            "type": "code_contains",
            "pattern": "15"
          },
          {
            "type": "code_contains",
            "pattern": "-"
          }
        ]
      }
    },
    {
      "title": "Subtracting Money",
      "content": "Tom has \\$25 and spends \\$8 on lunch. How much money does he have left?",